{
  "schema": "source-snapshot.v1",
  "source_repo": "synthetic/frozen-truth",
  "source_commit": "1111111111111111111111111111111111111111",
  "source_tree": "2222222222222222222222222222222222222222",
  "repository_snapshot_digest": "sha256-3333333333333333333333333333333333333333333333333333333333333333",
  "producer_version": "synthetic-fixture-v1",
  "truth_root_sha256": "4444444444444444444444444444444444444444444444444444444444444444",
  "truth_graph_sha256": "5555555555555555555555555555555555555555555555555555555555555555",
  "lean_report_sha256": "6666666666666666666666666666666666666666666666666666666666666666",
  "blueprint_tree_digest": "sha256-7777777777777777777777777777777777777777777777777777777777777777",
  "theory_tree_digest": "sha256-8888888888888888888888888888888888888888888888888888888888888888",
  "library_tree_digest": "sha256-9999999999999999999999999999999999999999999999999999999999999999",
  "evidence_digest": "sha256-aaaaaaaaaaaaaaaaaaaaaaaaaaaaaaaaaaaaaaaaaaaaaaaaaaaaaaaaaaaaaaaa",
  "derived_at": "2026-01-01T00:00:00Z",
  "blessed_by": "synthetic-human-fixture"
}
